article_id,title,lunar_date,text_kor,text_han
kla_10102012_002,정부와 육조의 참판 이상이 권제를 따를 것을 자전에 아뢰다,1545-02-12L0,"정부와 육조의 참판 이상이 자전에게 아뢰기를, ""조정이, 권제를 따를 것을 대전(大殿)께 청하였으나 윤허받지 못하였는데 자전께서 친림하여 권하셔서 허락받았다는 분부가 계셨으니, 조정에서 누구인들 기쁘고 위로가 되지 않겠습니까. 이제 듣건대 대전께서는 이제까지 드시지 않는다 하니 사람들의 심정이 모두 민망해 합니다. 자전께서는 다방면으로 보호하소서."" 하니, 답하기를, ""고깃국을 내가 탕(湯)과 찬물(饌物)에 타서 들이게 하였으니 상시에 찬선을 권하는 것을 나도 어찌 범연하게 하였겠는가. 날마다 친히 가서 권하지는 못하더라도 늘 사람을 시켜 가서 권하여 마지 않고 있다. 주상께서 편안하신 뒤에야 한 나라가 모두 편안한 것인데 내가 어찌 감히 소홀히 할 수 있겠는가."" 하고, 이어 대신과 사관(史官)에게 술을 공궤(供饋)하게 하였다. 윤인경 이 대전에게 아뢰기를, ""이제 듣건대 이제까지도 권제를 따르시지 않는다 하니 일국의 신민이 누구인들 민망해하지 않겠습니까. 조정이 홀로 청하였더라도 위에서 이미 윤허하셨으면 진실로 중간에 고치실 수 없는 것인데, 더구나 자전께서 친히 권하시어 이미 명에 따를 것을 허락하시고서도 실은 따르시지 않고 있으니, 매우 미안합니다. 참으로 종사(宗社)의 부탁을 중하게 여기신다면 한 몸을 가볍게 여기실 수 없는 것인데, 더구나 이제 산릉의 일이 끝났으니 더욱 애써 따르지 않을 수 없습니다."" 하니, 답하기를, ""들지 않는다는 말은 잘못 전해진 것이다."" 하였다. 성세창 이 말하기를, ""위의 분부가 이러하시어 다시 아뢸 수 없으니 이만 하고 물러가야 합니다."" 하였으나, 윤인경 이 말하기를, ""이만 하고 그만둘 수 없습니다."" 하였다. 드디어 아뢰기를, ""전교는 번번이 이러하시더라도 드신 사실이 없습니다. 백방으로 생각하여 보아도 다른 약은 보탬이 없으니 빨리 권제를 따르시지 않을 수 없습니다. 임금과 신하나 아버지와 아들 사이에 정의(情意)가 어찌 다르겠습니까. 들어가 면대하여 친히 찬선을 살피게 하여 주소서."" 하니, 답하기를, ""면대하지 않더라도 이미 따르고 있다."" 하였는데, 윤인경 등이 드디어 물러갔다.  사신은 논한다. 성세창 이 말한 것을 보면 성심에서 나온 것이 아니고 남에게 견제되어 한 것이다.","○政府及六曹參判以上啓于慈殿曰: ""朝廷以從權事, 請于大殿, 不得允許, 自慈殿親臨勸之, 有得請之敎, 朝廷孰不欣慰? 今聞大殿至今不進, 群情咸以爲悶。 請自慈殿多方保護。"" 答曰: ""肉汁, 予令於湯中饌物, 交和以進, 常時勸膳, 予亦豈偶然爲之? 雖未能日日親往勸之, 常常使人往勸不已。 主上安然後, 一國擧安, 予何敢忽諸?"" 仍饋大臣及史官酒。 <index num=""0853032_0"" ref=""M_0003908"" sort=""K"" type=""이름"">尹仁鏡</index>啓于大殿曰: ""今聞至今尙不從權, 一國臣民, 孰不爲悶? 雖朝廷獨請, 上旣允許, 則固不可中改, 況自慈殿, 親自勸之, 旣許從命, 而實不從, 至爲未安。 苟以宗社付託爲重, 則一身不可輕, 況今山陵事完, 尤不可不勉從。"" 答曰: ""不進之語, 虛傳也。"" <index num=""0853033_0"" ref=""M_0002891"" sort=""K"" type=""이름"">成世昌</index>曰: ""上敎如是, 不可更啓, 可止此而退。"" <index num=""0853034_0"" ref=""M_0003908"" sort=""K"" type=""이름"">仁鏡</index>曰: ""不可止此而已。"" 遂啓曰: ""傳敎雖每如此, 而無進之之實, 百計思之, 他藥無益, 不可不亟從權制。 君臣父子之間, 情意何異? 請入面對, 親自視膳。"" 答曰: ""雖不面對, 已從矣。"" <index num=""0853035_0"" ref=""M_0003908"" sort=""K"" type=""이름"">仁鏡</index>等遂退。                            <postScript type=""史論"">                 【史臣曰: ""見<index num=""0853036_0"" ref=""M_0002891"" sort=""K"" type=""이름"">世昌</index>所言, 非誠而牽於人也。""】               </postScript>                        【史臣曰: ""見<index num=""0853036_0"" ref=""M_0002891"" sort=""K"" type=""이름"">世昌</index>所言, 非誠而牽於人也。""】 "
kla_10102013_001,대사헌 송인수와 대사간 이윤경이 진찰할 것을 아뢰다,1545-02-13L0,"대사헌 송인수(宋麟壽) 와 대사간 이윤경(李潤慶) 등이 아뢰기를, ""전하께서 소절(小節)을 굳게 지켜 병을 숨기고 찬선을 물리치는 것이 이토록 극에 달하시니 안팎이 막혀 사람의 마음이 위의(危疑)스러워합니다. 임금과 신하는 아버지와 아들 같은데 임금에게 병이 있는데도 신하가 모르고 있다면 되겠습니까. 대신이 면대를 간청하여 두 번 아뢰었으나 두 번 다 물리친 채 간절한 뜻을 살피시지 않으시니, 신들은 서운함을 견딜 수 없습니다. 우리 선왕(先王) 때에는 종척(宗戚)을 연대(延對)하여 수라(水剌)를 돕게 하는 제도가 있었으니, 종척의 중신(重臣)을 사옹 제조(司饔提調)로 삼아 날마다 번갈아 입시하여 찬선을 드시는 여부를 살펴 상의 옥체가 회복되시기를 기다리게 하소서. 또 내의(內醫)를 시켜 날마다 들어가 진찰하여 증세가 있는 대로 곧 다스리게 하시기를 지극히 바라 마지 않습니다."" 하니, 답하기를, ""권제를 따르는 일에 대해서는 어제 대신의 의견에 답한 데에 지나지 않는다. 종척을 연대하는 일은 선왕 때에 이런 제도가 있었더라도 어찌 이것으로 나의 음식 먹는 것을 살피게 할 수 있겠는가."" 하였다.","○丙午/大司憲<index num=""0853037_0"" ref=""M_0003032"" sort=""K"" type=""이름"">宋麟壽</index>、大司諫<index num=""0853038_0"" ref=""M_0004898"" sort=""K"" type=""이름"">李潤慶</index>等啓曰: ""殿下固守小節, 諱疾却膳, 至於此極, 內外隔絶, 群情危疑。 君臣猶父子也, 君父有病, 而臣子不知可乎? 大臣懇請面對, 再啓而再拒, 不察懇迫之情, 臣等不勝缺望。 我先王朝, 延對宗戚, 有副水剌之制, 請以宗戚重臣, 爲司饔提調, 輪日入侍, 視進膳與否, 以竢上體平復。 且令內醫逐日入診, 隨證隨治, 不勝至願。"" 答曰: ""從權事, 不過於昨日答大臣之意。 對宗戚事, 先朝雖有此制, 何可以此驗予之食否?"" "
kla_10102015_001,햇무리가 지다,1545-02-15L0,햇무리가 졌다.,○戊申/日暈。 
kla_10102014_005,면대를 청하는 홍문관의 차자,1545-02-14L0,"홍문관이 차자를 올렸는데, 대략은 다음과 같았다. ""천하의 사리에는 경중의 당연한 것이 절로 있는데, 상경(常經)에만 얽매인 채 임시로 변통할 줄 모른다면 생각에 융통성이 없어 처치에 중도를 잃게 되고 따라서 눈앞의 가까운 일에 대하여는 스스로 잘 지킨다고 여길지라도 원대한 일은 이미 바로잡을 수가 없게 되는 것입니다. 이러하면 필부라도 제 몸을 보전하기 어려운 것인데 더구나 조종의 큰 기업(基業)과 민사(民社) 192) 의 중한 부탁을 받은데이겠습니까. 전하께서 그지없는 아픔을 머금고 이미 손상된 근력을 억지로 견디며 돌보시지 않은 것은 본디 인정이 반드시 그렇게 되는 것으로 천성에서 나와 스스로 마지 못하시는 것이겠습니다. 그러나 홀로 능묘(陵墓) 곁에 여막을 지어 상기(祥期)·담기(禫期) 193) 를 다하시지 못하는 것은, 참으로 종사(宗社)와 상례(喪禮)는 경중이 현격히 달라서 결코 자기의 심정에 따라 스스로 사서인과 같게 할 수 없기 때문입니다. 그렇다면 전하의 몸은 이미 종사에 매여 있어 자유롭지 못한 것이니 당연한 사리를 따라 감히 거스를 수 없는 것입니다. 요즈음 성체(聖體)가 오랫동안 손상되어 기맥이 이미 병들었는데 한때 절실한 정의(情意)에만 얽매여 선왕의 중한 부탁을 가벼이 여기신다면, 전하에 있어서는 불효가 되고 신하에 있어서는 불충이 되므로 감히 권제(權制)를 따르시도록 청하는 일을 고집하여 여러날 동안 간절히 아뢰었던 것입니다. 끝에 비로소 윤허를 내리셨으므로 대소 신료(臣僚)가 모두 감격하여 전하께서 과연 능히 종사와 백성을 생각하시어 경중의 마땅함을 잃지 않았다는 것을 알았습니다. 그러나 윤허받은 뒤로 이제 이미 며칠이 지났어도 따르신 실상은 듣지 못하고 아직 권제를 따르시지 않는다는 말이 이미 견문(見聞)에 전하고 있으니, 신들은 애통한 마음을 금할 수가 없습니다. 상중에 고기를 먹는 것은 슬픔을 잊어서가 아니고 바로 병 때문에 약을 먹는 것인데, 유독 성명(聖明)하신 전하께서 종사를 위하여 따르시지 못한다는 말입니까. 또 겉으로는 받아들인 것을 보이고 속으로는 자기 소견을 고집하는 것은 작은 일에 있어서도 아름다운 뜻이 아닌데, 더구나 국가에 관계되는 것이고 사리에 그만둘 수 없는 것인데이겠습니까. 터럭만큼이라도 그 사이에서 머뭇거림으로써 안팎의 성의가 맞지 않게 할 수 있겠습니까? 전하께서 처음부터 드실 마음이 없는데도 도리어 드신 자취를 보이시어 성신(誠信)한 뜻이 위아래에서 막혔으니, 이것이 어찌 처음 즉위하여 성심으로 사귀는 아름다움이겠습니까. 군신(君臣)의 윤리는 부자와 다를 것이 없어 정의(情義)의 친근함에 존비(尊卑)의 간격이 없는 것이므로 낮에 세 번 접견하고 밤에도 마주 대하여 조용하고 친밀하게 의견을 교환하는 즈음에 절로 보양(保養)하는 공이 있는 것으로, 지존(至尊)의 귀한 것이 이 때문에 굽혀지지 않고 궁위(宮闈)의 엄한 것이 이 때문에 설만해지지는 않는 것입니다. 더구나 지금 상중에 계시어 군국(軍國)의 기무(機務)를 모두 대신에게 맡기셨으니, 때때로 소대(召對)를 내려 간격이 없는 뜻을 보임으로써 상하가 화합하고 내외가 일체가 되게 하셔야 할 것입니다. 이것은 우리 선왕께서 이미 행하신 일인데 요즈음에는 폐습에 얽매여 옛일을 거의 폐기하셨습니다. 성후(聖候)가 미령하신 지 이제 이미 누순(累旬)이 되었고 말품(末品)인 의관(醫官)도 출입할 수 있는데 묘당(廟堂)의 대신은 한 번도 나아가 뵙지 못하였으니, 원수(元首)와 고굉(股肱)이 서로 친숙하다는 의의를 극진히 하는 방도가 아닙니다. 이미 경중의 권형을 잃어서 서로 막히는 형세가 이루어졌으므로 심지어 고락을 같이 하는 지친(至親)이 합문(閤門)을 두드리며 면대를 청하여도 한 번도 접견을 허락하시지 않으니, 친족을 친근히 하는 도리에도 미진한 데가 있는 듯합니다. 바라건대 전하께서는 사리의 극치를 깊이 구명하여 권제를 따르도록 허락하시어 성궁(聖躬)을 보전하시고, 빨리 대신과 종척(宗戚)을 인견하여 면대해서 따르는 실상을 보이심으로써 중외의 답답함을 시원하게 풀게 해주신다면 더없이 다행하겠습니다.""","○弘文館上箚, 略曰:                            <quotation>天下事理, 自有當然之輕重, 苟或泥於常經, 不通以權, 則計慮膠固, 處置失中, 當前近事, 自謂能守, 而遠者大者, 已無所救。 是則雖匹夫, 難保其身, 況祖宗基緖之大, 民社付托之重者哉? 殿下茹罔極之痛, 强已傷之力, 有所不顧者, 固人情所必至, 發於天衷而不自已也。 然獨不能結廬陵墓之側, 以盡祥禫之期者, 誠以宗社與喪禮, 輕重截然, 決不可徇一己之情, 以自同於士庶也。 然則殿下之身, 已不得自由, 而付之宗社, 隨事理當然, 而不敢逆也。 今者聖體久傷, 氣脈已病, 若拘一時情義之切, 輕先王付畀之重, 則在殿下爲不孝, 而在臣子爲不忠, 故敢執從權之請, 懇啓累日。 始降兪音, 大小臣工, 咸自感激, 知殿下果能以宗社生民爲心, 動不失輕重之宜也。 蒙允之後, 今已數日, 未聞俯從之實, 而尙未從權之言, 已傳於見聞, 臣等痛切于懷, 不能自已。 居憂食肉, 非所以忘哀, 乃爲病而服藥也, 以殿下聖明, 獨不能爲宗社俯就之乎? 且外示聽受, 而內執己見, 雖在細微, 猶非美意, 況乎國家所關事理之所不可已者? 其可有一毫遲疑於其間, 而使內外之誠意未孚哉? 殿下初無進御之心, 而反示進御之迹, 誠信之意, 隔乎上下, 此豈初服有孚交如之美耶? 君臣之倫, 無異父子, 情義之親, 不間尊卑, 晝日三接, 夜半前席, 從容款密之際, 自有保(傳)<annotation type=""교감주"">                   <noteTitle>〔全〕</noteTitle>                 </annotation>頤養之功, 至尊之貴, 不因是而屈, 宮闈之嚴, 不因是而褻矣。 況此疚棘諒闇之中, 軍國機務, 一委大臣, 所當時賜召對, 以示無間之意, 使上下相孚, 內外一體。 斯乃我先王所已行者, 而近拘弊習, 幾廢故事。 聖候失寧, 今已累旬, 醫官末品, 猶得出入, 而廟堂大臣, 一未進見, 非所以盡元首股肱相與之義也。 旣失輕重之權, 以致阻隔之勢, 至於同休戚至親, 扣閤求對, 猶不許一接, 恐於親親之道, 猶有所未盡。 伏願殿下, 深究事理之極致, 許從權制, 以保聖躬, 亟引大臣宗戚, 面示俯從之實, 使中外洞釋, 不勝幸甚。</quotation>              "
kla_10102017_001,약방 제조·홍문관 등이 칠우제 등을 친히 지내지 말라고 아뢰다,1545-02-17L0,"약방 제조·홍문관·사헌부가 아뢰기를, ""상의 옥체가 조금 회복되신 듯하더라도 원기가 지극히 손상되셨으므로 범야(犯夜)하면서 노동하면 반드시 크게 손상하게 되어 다른 증세를 유발시킬 것이니, 칠우제를 친행하는 일을 멈추고 안정하여 조리해서 졸곡을 기다려 지내소서."" 하니, 답하기를, ""근일에는 음식과 기후가 평소와 같고 우제를 여러번 지내지 못하였으므로 칠우제·졸곡제를 지내려 하는데 어찌 제사지내는 것 때문에 증세가 더해지겠는가. 그러니 첨계(僉啓) 194) 를 따르지 않는다."" 하였다.","○庚戌/藥房提調、弘文館、司憲府啓曰: ""上體雖似小蘇, 而元氣極傷, 犯夜勞動, 必致重傷, 以生他證, 請停七虞親行, 安靜調保, 待卒哭行之。"" 答曰: ""近日食飮氣候似平, 虞祭累不得行, 故欲行七虞卒哭祭, 豈以行祭之故, 至於加證乎? 玆以不從僉啓。"" "
kla_10102020_001,정원이 졸곡제 후의 상식을 친행하지 말도록 청하다,1545-02-20L0,"정원이 아뢰기를, ""위에서는 졸곡제 뒤에 이어서 상식(上食)을 올리려 하시나, 밤에 노동하시고 또 이어서 상식을 올리면 반드시 다른 증세를 유발시킬 것이니, 신들의 생각으로는 지내서는 안 될 것으로 여겨집니다."" 하니, 전교하기를, ""전에도 우제 뒤에 상식을 올리려 하였으나 조정이 내가 조리하기를 바랐기 때문에 지내지 않았다. 이제는 기후가 평소와 같다. 어찌 스스로 헤아리지 않고서 지내려 하겠는가."" 하였다.","○癸丑/政院啓曰: ""自上欲於卒哭祭後, 仍行上食, 夜又勞動, 又仍行上食, 則必生他證, 臣等之意, 以爲不可行。"" 傳曰: ""前於虞祭後, 亦欲行上食, 而朝廷欲予調保, 故不行。 今則氣候平常。 豈不自度料, 而欲行乎?"" "
kla_10102021_001,졸곡제를 친행하다,1545-02-21L0,상이 졸곡제를 친행하였다.,○甲寅/上親行卒哭祭。 
kla_10106008_001,대간이 이화종 등과 권물의 일을 아뢰다,1545-06-08L0,"대간이 이화종 등과 권물 의 일을 아뢰었으나, 윤허하지 않았다.","○己亥/臺諫啓<index num=""0854577_0"" ref=""M_0005462"" sort=""K"" type=""이름"">李和宗</index>等及<index num=""0854578_0"" ref=""M_0000123"" sort=""K"" type=""이름"">權勿</index>事, 不允。 "
kla_10102021_004,이성군 이관 등 종실이 권제를 따를 것을 청하다,1545-02-21L0," 이성군(利城君)  이관(李慣) 등이 종실(宗室) 2백여 원(員)을 거느리고 아뢰기를, ""오늘 신들이 바라보건대 천안이 매우 수척하여 혈색까지 없으시니 근심스럽고 민망하기 그지없습니다. 졸곡이 이미 지나고 큰일이 이미 끝났으므로, 고기를 드실 것을 전에 이미 계청하였고 위에서도 애써 따르겠다 하셨습니다. 그러나 아직도 드시는 것을 보지 못하였으므로 이를 민망히 여겨 감히 아룁니다."" 하니, 답하기를, ""이미 권제를 따랐어도 낯빛이 이러하니 나도 그 까닭을 모르겠다. 어찌 따르지 않았겠는가."" 하였다. 관(慣) 등이 다시 아뢰기를, ""위의 분부는 이러하더라도 외인(外人)은 그 사실을 알지 못하니 친히 들어가 찬선(饌膳)을 살피게 하여 주소서."" 하니, 답하기를, ""내 말을 믿지 않고 되풀이하여 이렇게 말하니 매우 미안하다. 들어와 보지 않아도 따르지 않는 일이 없을 것이다."" 하였다.","○<index num=""0853051_0"" ref=""M_0014070"" sort=""K"" type=""이름"">利城君</index>               <index num=""0853052_0"" ref=""M_0014070"" sort=""K"" type=""이름"">慣</index>等率宗室二百餘員啓曰: ""今日臣等共望天顔, 極爲毁瘠, 至無血色, 憂憫罔極。 卒哭已過, 大事已畢, 進肉事, 前已啓請, 自上以爲勉從。 而未見有進御, 斯以爲憫敢啓。"" 答曰: ""已從權而顔色如此, 予亦不知其故也。 豈爲不從乎?"" <index num=""0853053_0"" ref=""M_0014070"" sort=""K"" type=""이름"">慣</index>等再啓曰: ""上敎雖如此, 而外人未能知其實, 請親入視膳。"" 答曰: ""不信予言, 再再言之如此, 至爲未安。 雖不入見, 亦無不從。"" "
kla_10102021_006,약방 제조가 음식을 잘 드셔야 한다고 아뢰다,1545-02-21L0,"약방 제조가 아뢰기를, ""이제 진찰한 의원의 말을 듣건대 비위가 매우 허약한 것이 전과 다름이 없다고 합니다. 비위는 모든 장기(臟器) 중에서 중요하거니와 오행(五行)은 토(土)에 의지하여 살고 모든 장기는 비위에 의지하여 사는데, 지금 시기를 잃고 조리하지 않으면 반드시 중한 증세를 유발시키게 될 것입니다. 전에 아뢴 식치(食治)의 방도는 아무리 좋은 약이라도 이보다 나을 수 없으니 드소서."" 하니, 답하기를, ""전에 아뢴 식치하는 일은 곧 아뢴 대로 하였거니와 이제는 더욱 애써 들겠다."" 하였다.","○藥房提調啓曰: ""今聞診醫之言, 脾胃極爲虛弱, 如前不減。 脾胃重於諸臟, 五行以土爲資生, 諸臟以脾胃爲資生, 失今不調治, 則必生重證。 前所啓食治之方, 良藥無過於此, 請進御。"" 答曰: ""前啓食治事, 卽依啓爲之, 今則尤當勉進。"" "
kla_10102023_001,간원이 지세방·양윤영 등의 파면을 건의하다,1545-02-23L0,"간원이 아뢰기를, ""광주 목사(光州牧使) 박수량(朴守良) 은 2품인 사람으로서 폄박(貶駁)받은 허물이 없는데도 목사로 낮추어 제수하였으니 국가에서 재상을 대우하는 도리에 있어 미진한 점이 있습니다. 또 듣건대 병이 아직 낫지 않아서 제때에 올라오지 못한다 하니 체직시키소서. 군기시 정(軍器寺正) 안수량(安秀良) 은 경전(經傳)의 구두 정도는 대강 이해하고 있습니다만 아직 사표(師表)의 명망은 없으니, 학직(學職)에 제수한다면 오히려 괜찮겠으나 가려서 차출하는 반열에 둘 수는 없습니다. 사유(師儒)로서 광주 목사에서 체직된 것도 이미 옳지 않은데 이제 또 곧 다른 벼슬에 주의하였으니 전조(銓曹)도 잘못입니다. 안수량 을 광주 목사에 잉임(仍任)시키소서. 충청도 수군 절도사(忠淸道水軍節度使) 지세방(池世芳) 은 꺼림 없이 방자하고 군졸을 침탈하여 폐단을 끼침이 매우 심하며,  영흥 부사(永興府使) 양윤영(梁允英) 은 성품이 본디 탐욕스럽고 또 무식한데다가 백성에게서 많이 거둬들여 자기를 이롭게 하는 것만을 일삼으므로 백성을 다스리는 벼슬에 맞지 않으니, 모두 파면시키소서."" 하니, 모두 아뢴 대로 하라고 답하였다.","○丙辰/諫院啓曰: ""<index num=""0853068_0"" sort=""K"" type=""지명"">光州</index>牧使<index num=""0853069_0"" ref=""M_0002526"" sort=""K"" type=""이름"">朴守良</index>, 以二品之人, 非有貶駁之咎, 而降授牧使, 於國家待宰相之道未盡。 且聞病猶未差, 不能趁時上來, 請遞。 軍器寺正<index num=""0853070_0"" ref=""M_0003301"" sort=""K"" type=""이름"">安秀良</index>, 雖於經傳粗解口讀, 未有師表之望, 例授學職, 則猶可矣, 不必在擇差之列。 以師儒遞<index num=""0853071_0"" sort=""K"" type=""지명"">光州</index>牧使, 已爲不可, 今又旋擬於他職, 銓曹亦爲非矣。 請以<index num=""0853072_0"" ref=""M_0003301"" sort=""K"" type=""이름"">秀良</index>, 因任<index num=""0853073_0"" sort=""K"" type=""지명"">光州</index>牧使。 <index num=""0853074_0"" sort=""K"" type=""지명"">忠淸道</index>水軍節度使<index num=""0853075_0"" ref=""M_0057057"" sort=""K"" type=""이름"">池世芳</index>, 縱恣無忌, 侵暴軍卒, 貽弊太甚。 <index num=""0853076_0"" sort=""K"" type=""지명"">永興</index>府使<index num=""0853077_0"" ref=""M_0037116"" sort=""K"" type=""이름"">梁允英</index>, 性本貪婪, 又不識字, 厚斂於民, 唯以利己爲事, 不合臨民之官, 請竝罷。"" 答曰: ""皆如啓。"" "
kla_10102025_002,고부 청시사 민제인 등이 중국 사신 일행의 출발을 보고하다,1545-02-25L0,"고부 청시사(告訃請諡使) 민제인(閔齊仁) 과 이준경(李浚慶) 이 장계(狀啓)하였다. ""대행 대왕의 시호를 공희(恭僖) 라 내렸고, 태감(太監) 왕도(王燾) 와 행인(行人) 장승헌(張承憲) 을 조제사(弔祭使)로 차출하고 태감(太監) 장봉(張奉) · 오유(吳猷) 를 봉왕사(封王使)로 차출하여 3월 초에 출발할 것이라 합니다.""","○告訃請諡使<index num=""0853133_0"" ref=""M_0002340"" sort=""K"" type=""이름"">閔齊仁</index>、<index num=""0853134_0"" ref=""M_0005159"" sort=""K"" type=""이름"">李浚慶</index>狀啓曰: ""賜大行大王諡曰<index num=""0853135_0"" ref=""M_0057021"" sort=""K"" type=""이름"">恭僖</index>, 以太監<index num=""0853136_0"" ref=""M_0051435"" sort=""A"" type=""이름"">王燾</index>、行人<index num=""0853137_0"" ref=""M_0007141"" sort=""A"" type=""이름"">張承憲</index>, 差弔祭使, 以太監<index num=""0853138_0"" ref=""M_0011379"" sort=""A"" type=""이름"">張奉</index>、<index num=""0853139_0"" ref=""M_0051070"" sort=""A"" type=""이름"">吳猷</index>, 差封王使, 將以三月初發行。"" 云。 "
