article_id,title,lunar_date,text_kor,text_han
kla_10106028_002,약방 제조 등이 문안하다,1545-06-28L0,"약방 제조·승지·사관이 새벽에 경회루 아래에 들어가 문안하니, 박세거 가 나와서 말하기를, ""간밤에는 열이 더 심하지 않고 미음을 들기도 그다지 어려워하지 않으셨으니, 오늘 큰 열이 없으면 걱정이 없을 듯합니다."" 하였다. 임백령 · 송기수 가 묻기를, ""원기는 어떠한가?"" 하니, 답하기를, ""왼손·오른손의 맥에 다 착잡한 맥은 없으나 다만 열이 내린 뒤에 원기가 점점 없어져 아주 없어지게 될까 염려될 뿐입니다. 아마도 그러한 까닭은 애통하여 수척한 것이 극도에 이르렀기 때문에 장부(臟腑)가 매우 손상되어 병이 뿌리가 있는 듯합니다."" 하였다. 윤인경 이 이어서 아뢰기를, ""오늘은 이미 늦었는데도 약을 드시지 않으니 혹시 열기가 다시 일어날 것이 염려됩니다. 의원(醫員)들이 모두 ‘이때에 급히 약을 드시지 않으면 형세가 기울어질 것이니 아무리 편작(扁鵲) 이라도 어떻게 손댈 수 있겠는가.’ 하니, 더욱이 답답하고 염려됩니다."" 하니, 답하기를, ""내가 어찌하여 약을 먹지 않겠는가. 이것은 반드시 의원들이 전한 것이겠는데 전한 자가 또한 망령되다. 이제 아뢴 대로 약을 먹겠다."" 하였다.","○藥房提調、承旨、史官, 曉入于<index num=""0854807_0"" sort=""K"" type=""지명"">慶會樓</index>下問安, <index num=""0854808_0"" ref=""M_0002510"" sort=""K"" type=""이름"">朴世擧</index>出曰: ""去夜熱不加甚, 進粥飮, 亦不甚難之, 今日若無大熱, 則似必無患矣。"" <index num=""0854809_0"" ref=""M_0005560"" sort=""K"" type=""이름"">林百齡</index>、<index num=""0854810_0"" ref=""M_0002962"" sort=""K"" type=""이름"">宋麒壽</index>問曰: ""元氣如何?"" 答曰: ""左右手脈, 皆無錯雜之脈, 只恐退熱後, 元氣漸至澌盡耳。 恐其然者, 以其哀毁之極, 臟腑重傷, 受病有根也。"" <index num=""0854811_0"" ref=""M_0003908"" sort=""K"" type=""이름"">尹仁鏡</index>仍啓曰: ""今日已晩, 猶不進御藥物, 恐或有熱氣復作也。 醫員等皆曰: ‘不趁此時急於服藥, 則勢必傾矣, 雖<index num=""0854812_0"" ref=""M_0034080"" sort=""A"" type=""이름"">扁鵲</index>, 那能下手。’ 云, 尤爲悶慮。"" 答曰: ""予何不服藥? 是必醫輩所傳, 而傳之者亦妄也。 今當依啓服之。"" "
kla_10106028_003,유지번이 나와서 상의 병세를 전하다,1545-06-28L0," 유지번 이 나와서 말하였다. ""지금 들어가서 상의 맥후(脈候)를 진찰하였더니 어제보다 나은 듯합니다. 다만 저녁에는 또 어떠하실는지 모르겠습니다. 상이 지번 에게 하문하기를 ‘어떤 열이 내 몸에 들어와 왔다갔다 하면서 침공하는가? 이것이 더위에 상한 열인가, 한기에 상한 열인가?’ 하시기에, 지번 이 대답하기를 ‘이것은 다른 증세가 아니라 다만 더위에 상하여 열이 나는 것일 뿐입니다. 더위에 상한 증세가 매우 위급한데 상께서 약을 드시려 하지 않으니 나으실 기약이 없을까 매우 염려됩니다.’ 하니, 상이 이르기를, ‘짐짓 약을 물리치는 것이 아니라 때로는 입맛이 매우 써서 먹지 못할 뿐이다.’ 하셨습니다.""","○<index num=""0854813_0"" ref=""M_0003726"" sort=""K"" type=""이름"">柳之蕃</index>出曰: ""今刻入診上脈, 則比昨似歇。 但不知向夕則又何如也。"" 上下問于<index num=""0854814_0"" ref=""M_0003726"" sort=""K"" type=""이름"">之蕃</index>曰: ""有何熱入予身, 往來侵攻乎? 此熱之熱耶, 寒之熱耶?"" <index num=""0854815_0"" ref=""M_0003726"" sort=""K"" type=""이름"">之蕃</index>對曰: ""此非他證, 只爲傷暑發熱耳。 傷暑之證甚危急, 而自上不肯進藥物, 深恐差復無期也。"" 上曰: ""非故拒藥也, 有時口甚苦, 而不能下耳。"" "
kla_10106029_002,약방 제조 등이 문안하다,1545-06-29L0,"약방 제조·승지·사관이 경회루 아래 수각에 가서 문안하니, 유지번 이 나와서 말하기를, ""지난밤 삼경에 윤 판서(尹判書) 가 의원들을 다 들어오게 하였는데, 나인의 말이 ‘상께서 한참 잠드신 뒤에 갑자기 열에 괴로와하시는데 이따금 헛소리를 할 뿐 아니라 기운이 많이 지친 상태였다.’ 하였습니다. 지번 과 박세거 · 홍침 이 번갈아 들어 가서 진찰하였더니, 열은 내려간 듯하였으나 맥이 너무 약하고 잦아져 두려웠고 또 상께서 말씀하시는 것이 허망하고 어긋나지는 않으나 목소리가 다급하여 여느 때와 아주 같지 않았습니다. 미음을 권하여도 드시지 않고 약을 권하여도 드시지 않았는데, 짐짓 드시지 않는 것이 아니라 드시려 하더라도 기운이 허약하고 입에 거슬려서 받아들이지 못하시는 것입니다."" 하였다. 잠시 후에 박세거 · 홍침 이 나와서 말하기를, ""이제 또 상의 기후를 진찰하였더니 열의 증세는 잠시 덜한 듯하나 원맥(元脈)이 극도로 미약하여 말할 수 없습니다. 유지번 이 말하기를 ‘내가 보기에는 상의 증세가 반드시 맥이 가라앉을 걱정이 있을 듯하다. 병의 뿌리가 비위(脾胃)가 손상된 데에서 나왔는데 이토록 음식을 끊고 약을 물리치시니 위태하지 않을 수 있겠는가.’ 하였습니다."" 하였다. 약방 제조 등이 이 말을 듣고는 ‘상의 증세가 점점 위급하여 가는데 우리들이 늘 여기에 머무는 것은 또한 소원하고 게으른 듯하니 어침(御寢)에 가까운 곳으로 옮겨 가서 상의 안부가 어떠한지를 자주 알아보는 것만 못하다.’ 하여, 드디어 충순당(忠順堂) 앞에 나아가 머물렀다.","○藥房提調、承旨、史官, 詣<index num=""0854816_0"" sort=""K"" type=""지명"">慶會樓</index>下水閣問安, <index num=""0854817_0"" ref=""M_0003726"" sort=""K"" type=""이름"">柳之蕃</index>出曰: ""去夜三更, <index num=""0854818_0"" ref=""M_0000383"" sort=""K"" type=""이름"">尹判書</index>令醫等皆入, 內人有言: ‘上就寢良久後, 忽煩熱, 非徒間有譫語, 抑多困憊之狀。’ 云。 <index num=""0854819_0"" ref=""M_0003726"" sort=""K"" type=""이름"">之蕃</index>與<index num=""0854820_0"" ref=""M_0002510"" sort=""K"" type=""이름"">朴世擧</index>、<index num=""0854821_0"" ref=""M_0061387"" sort=""K"" type=""이름"">洪沈</index>, 遞相入診之, 則熱勢似微。 而但脈太細數可畏, 且自上語言, 雖不妄錯, 而聲音急遽, 大不類於平昔。 勸進粥飮不進, 勸進藥不進, 非故爲不進也, 雖欲進之, 而氣虛口逆, 不能容受耳。"" 俄而, <index num=""0854822_0"" ref=""M_0002510"" sort=""K"" type=""이름"">朴世擧</index>、<index num=""0854823_0"" ref=""M_0061387"" sort=""K"" type=""이름"">洪沈</index>出曰: ""今又診上候, 則熱證雖似暫減, 而元脈極爲微弱, 不可說不可說。"" <index num=""0854824_0"" ref=""M_0003726"" sort=""K"" type=""이름"">柳之蕃</index>曰: ""以吾觀之, 上證, 恐必有澌盡之患也。 病根出自脾胃之傷敗, 而絶食拒藥, 至於如此, 能無危乎?"" 藥房提調等聞此言, 以爲: ""上之證勢, 漸至危急, 而我輩常住于玆, 亦若遠緩, 不如移就于御寢近處, 頻探上之安否何如耳。"" 遂進次于<index num=""0854825_0"" sort=""K"" type=""지명"">忠順堂</index>前。 "
kla_10106029_003,자전이 정원에 이어하겠다는 뜻을 전교하다,1545-06-29L0,"이날 이른 아침에 자전(慈殿)이 정원에 전교하기를, ""이제 들으니 상의 증세가 전보다 훨씬 더 위중(危重)하시다 한다. 일이 이러한 극도에 이르렀는데도 먼 곳에 떨어져 있는 것이 더욱이 미안하므로 하는 수 없이 의혜 공주(懿惠公主) 의 집으로 옮아가서 자주 안부를 물어야 하겠으니, 모든 일을 빨리 갖추라."" 하니, 가승지 조광원 등이 아뢰기를, ""마땅히 이 전교를 정원에 알려서 가부를 받아 와서 다시 아뢰겠습니다."" 하고, 곧 가주서(假注書) 안명세(安名世) 를 시켜 글로 정원에 알렀다. 이때 정원과 영상·좌상이 바야흐로 경회루 아래 수각에 모여 의논하는데, 또 내시가 창경궁 에서 와서 자전의 분부를 전하기를, ""상의 옥체가 극도로 편안하지 못하신데도 여기에 멀리 있는 것은 참으로 미안하므로 가까이 공주의 집에 가서 안부를 자주 물으려 하였으나, 대신 제공(諸公)이 멈추기를 청하였기 때문에 멈추었다. 이제는 상의 증세가 더욱이 위급하시니 결코 옮아가지 않을 수 없으므로 감히 고한다."" 하니, 윤인경 등이 의논하여 회계하기를, ""공주의 집은 여염 사이에 있으므로 결코 이어(移御)하셔서는 안 되겠으나, 자전께서 이토록 굳이 이어하려 하시고 신들이 여러 번 방계(防啓)하는 것도 황공하니, 마지 못하면 곧바로 승정원(承政院) 【 경복궁(景福宮)의 정원이다.】 에 이어하시는 것이 어떠하겠습니까?"" 하였다. 의논하여 알리는 일이 끝나고서, 좌상이 빈청으로 물러나오니, 재상들이 다 거기에 모여 있었다. 【 이기(李芑)·이언적(李彦迪)·유인숙(柳仁淑)·정옥형(丁玉亨)·허자(許磁) 등이 다 참여하였다.】 양사(兩司)의 장관(長官) 【대사헌(大司憲)                           민제인(閔齊仁), 대사간(大司諫)                           구수담(具壽聃).】 이 좌상에게 진언(進言)하기를, ""대비께서 정원에 계시면 일이 매우 어려워질 것입니다. 동쪽을 출납(出納)하는 곳으로 삼더라도 일의 체모에 질서가 없으니 의리에 있어서 어떠하겠습니까."" 하고, 구수담 은 말하기를, ""대비께서 근처에 옮아 오려 하시는데 굳이 멈추도록 청하는 것은 미안하거니와, 공주의 집이 여염 사이에 있기는 하나 여느 때와는 같지 않으니 오히려 정원보다 낫지 않겠습니까? 정원에 계신다면 약을 올리는 의원과 윤임 이 입시(入侍)하는 것이 다 자유롭지 못할 것입니다."" 하고, 나숙(羅淑) 은 말하기를, ""내 생각도 그러합니다."" 하니, 좌상이 말하기를, ""대비께서 여염 사이에 계시면 뒤에 반드시 전례가 될 것이니 매우 미안합니다. 그러나 영상에게 다시 의논하겠습니다."" 하였다. 곧 대교(待敎) 이염(李爓) 을 불러 영상에게 고하기를, ""대비께서 정원에 이어하는 일은 양사·홍문관이 다 옳지 않다 하니 우선 멈추도록 청하되, 윤허하지 않거든 계실 곳을 다시 의논하는 것이 어떠하겠습니까?"" 하였더니, 영상이 말하기를, ""우리의 처음 생각에도 약시중을 드는 사람들이 드나들기가 어렵다고 여겼으므로 대비께서 대내(大內)로 들어 오시는 것을 바라지 않았고, 또 여염은 일의 체모에 방해될 듯하므로 그렇게 하였으나, 조정(朝廷)의 뜻이 그러하다면 다시 아뢰는 것이 옳겠다."" 하였다. 그때 영상은 충순당(忠順堂) 앞 합문(閤門) 안에 있으면서 윤임 이 나오기를 기다려 상의 기후를 물으려 하였다. 이염 이 이 말을 좌상에게 다시 알리니, 좌상이 그렇게 하겠다고 말하고, 사인(舍人)을 불러 대비에게 사연을 아뢰려 하는데, 대비가 내시를 시켜 와서 분부하기를, ""3∼4일 동안 청원위(淸原尉) 의 집에 이어하려 하는데 무슨 안 될 것이 있겠는가. 두 대궐이 떨어져 있어서 이따금 온편하지 못한 일이 있으니, 대신이 이어하는 것을 바라지 않기는 하나 청원위 의 집에 가서 머물다가 상의 기후가 회복되시기를 기다려서 곧 환궁(還宮)하겠다. 승정원은 처소가 불편하여 결코 가서 있기가 여려우니 반복하여 생각하여도 청원위 의 집만큼 온편하지 못하며, 또 상의 옥체가 바야흐로 편안하지 못하신데 내가 거둥하겠다는 뜻을 누가 감히 아뢰겠는가."" 하였다. 그래서 대신과 정원·대간·홍문관이 또 멈추도록 청하니, 대비가 다시 내시를 보내어 답하기를, ""대신 등이 힘써 청하기 때문에 이어하지 않겠다."" 하였다.","○是早, 慈殿傳于政院曰: ""今聞上證, 比前倍重。 事至此極, 而猶在隔遠處, 尤爲未安, 不得已欲移往于<index num=""0854826_0"" ref=""M_0015058"" sort=""K"" type=""이름"">懿惠公主</index>(弟)<annotation type=""교감주"">                 <noteTitle>〔第〕</noteTitle>               </annotation>, 頻問安否, 速備諸事。"" 假承旨<index num=""0854827_0"" ref=""M_0005992"" sort=""K"" type=""이름"">曺光遠</index>等啓曰: ""當通此傳敎于政院, 取可否來更啓。"" 卽使假注書<index num=""0854828_0"" ref=""M_0003287"" sort=""K"" type=""이름"">安名世</index>, 書通于政院。 時政院及領、左相, 方會議于<index num=""0854829_0"" sort=""K"" type=""지명"">慶會樓</index>下水閣, 又有內侍, 自<index num=""0854830_0"" sort=""K"" type=""지명"">昌慶宮</index>來, 傳慈敎曰: ""上體極爲未寧, 而遠在於此, 心實未安, 故欲近就公主家, 頻問安否, 而以大臣諸公請停而停之。 今則上證, 尤爲危急, 決不可不移故敢告。"" <index num=""0854831_0"" ref=""M_0003908"" sort=""K"" type=""이름"">仁鏡</index>等議而回啓曰: ""公主(弟)<annotation type=""교감주"">                 <noteTitle>〔第〕</noteTitle>               </annotation>, 乃在閭閻之間, 決不可移御, 而慈殿强欲移御, 至於如是, 臣等屢度防啓, 亦所惶恐無已, 則請直移御于承政院, <annotation type=""원주"">                 <noteContent>【<index num=""0854832_0"" sort=""K"" type=""지명"">景福宮</index>政院也。】</noteContent>               </annotation>何如?"" 議報訖, 左相退來于賓廳, 有諸宰相皆會焉。<annotation type=""원주"">                 <noteContent>【如<index num=""0854833_0"" ref=""M_0000473"" sort=""K"" type=""이름"">李芑</index>、<index num=""0854834_0"" ref=""M_0004753"" sort=""K"" type=""이름"">李彦迪</index>、<index num=""0854835_0"" ref=""M_0003696"" sort=""K"" type=""이름"">柳仁淑</index>、<index num=""0854836_0"" ref=""M_0005847"" sort=""K"" type=""이름"">丁玉亨</index>、<index num=""0854837_0"" ref=""M_0060417"" sort=""K"" type=""이름"">許磁</index>等皆與焉。】</noteContent>               </annotation>兩司長官<annotation type=""원주"">                 <noteContent>【大司憲<index num=""0854838_0"" ref=""M_0002340"" sort=""K"" type=""이름"">閔齊仁</index>、大司諫<index num=""0854839_0"" ref=""M_0014177"" sort=""K"" type=""이름"">具壽聃</index>。】</noteContent>               </annotation>進言于左相曰: ""大妃御政院, 則事甚難。 雖自東邊, 爲出納之所, 事體顚倒, 於義若何?"" <index num=""0854840_0"" ref=""M_0014177"" sort=""K"" type=""이름"">具壽聃</index>曰: ""大妃欲移近, 而固請止之似未安, 公主家雖閭閻間, 非如常時, 不猶愈於政院乎? 若御政院, 則進藥醫員及<index num=""0854841_0"" ref=""M_0000383"" sort=""K"" type=""이름"">尹任</index>入侍, 皆不得自由。"" <index num=""0854842_0"" ref=""M_0036807"" sort=""K"" type=""이름"">羅淑</index>曰: ""吾意亦如是矣。"" 左相曰: ""大妃處閭閻間, 則後必成例, 甚爲未安。 然當更議于領相。"" 卽呼待敎<index num=""0854843_0"" ref=""M_0000563"" sort=""K"" type=""이름"">李爓</index>, 令告于領相曰: ""大妃移御政院事, 兩司、弘文館皆以爲不可, 姑且請止而不允, 則更議所御處何如?"" 領相曰: ""吾等初意, 亦以爲侍藥人等, 出入爲難, 故不欲大妃入內, 且閭閻則恐妨事體故如是, 而朝廷之意若然, 則更啓可也。"" 時, 領相在<index num=""0854844_0"" sort=""K"" type=""지명"">忠順堂</index>前閤門內, 將待<index num=""0854845_0"" ref=""M_0000383"" sort=""K"" type=""이름"">尹任</index>之出, 問上之氣候矣。 <index num=""0854846_0"" ref=""M_0000563"" sort=""K"" type=""이름"">李爓</index>以言還報于左相, 左相曰唯唯, 呼舍人, 將啓辭于大妃, 而大妃使內侍來傳曰: ""三四日移御<index num=""0854847_0"" ref=""M_0059325"" sort=""K"" type=""이름"">淸原尉</index>家, 有何不可? 兩闕阻隔, 間有未便之事, 大臣雖不欲移御, 然當往留<index num=""0854848_0"" ref=""M_0059325"" sort=""K"" type=""이름"">淸原尉</index>家, 待上候平復, 卽還宮。 承政院則處所非便, 決難往御, 反覆思之, 不如<index num=""0854849_0"" ref=""M_0059325"" sort=""K"" type=""이름"">淸原</index>家之爲便, 且上體方未寧, 予擧動之意, 誰敢達之?"" 於是大臣及政院、臺諫、弘文館, 又請止之, 大妃更遣內侍答曰: ""爲大臣等力請, 不移御矣。"" "
kla_10107002_008,대군 부인이 입궐하다,1545-07-02L0,유시(酉時)에 대군 부인(大君夫人)  【 별좌(別坐)                           심강(沈鋼)의 딸이고 참판(參判)                           심연원(沈連源)의 손녀이다.】 이 입궐(入闕)하였다.,"○酉時, 大君夫人<annotation type=""원주"">                 <noteContent>【別坐<index num=""0854943_0"" ref=""M_0058510"" sort=""K"" type=""이름"">沈鋼</index>之女, 參判<index num=""0854944_0"" ref=""M_0003233"" sort=""K"" type=""이름"">連源</index>之孫。】</noteContent>               </annotation>入闕。 "
kla_10106029_005,중궁은 내반원에 피어할 것을 권하다,1545-06-29L0,"중궁(中宮)은 내반원(內班院) 457) 에 피어(避御)한 전례 【상께서 병이 있으면 이곳에 이어하기도 하였다.】 가 있다 하여 상에게 빨리 피어하도록 권하려 하고, 영상(領相) 등은 내반원이 낮고 습하며 더러우므로 승정원(承政院)에 피어하는 것만 못하다 하여, 두곳을 수리하여 기다리게 하였으나, 상의 증세가 더욱 위급해져서 드디어 피어하지 못하였다.","○中宮以避御內班院曾有例,<annotation type=""원주"">                 <noteContent>【自上有疾, 則或移于此處。】</noteContent>               </annotation>欲勸上速移之。 領相等以爲, 內班卑濕陋穢, 不如避御于承政院, 使修理兩處而待之, 上證益至危急, 遂不果避御。 "
kla_10106029_006,신시에 상의 증세가 극도로 악화되다,1545-06-29L0,"신시(申時)에 상의 증세가 극도로 위급하였다. 중궁이 어찌할 수 없으므로 손가락을 잘라 피를 바치려 하였다. 말이 밖으로 새나가 영상 윤인경 등도 눈물을 쏟고는 이어서 손가락을 자르는 것은 이 증세에 보탬이 되지 않는다고 청하여 멈추게 하였다. 잠시 후에 유지번 이 나와서 말하였다. 【약방 제조와 승지·사관 등은 그때 아직도 충순당(忠順堂) 앞에 있었다.】  ""지금 시각에 들어가 상의 맥후(脈候)를 진찰하였더니 더욱 희미하고 잦으며 중간에 끊어지는 것이 많으니 지극히 답답합니다. 앞 시각에 궁중에서 곡성(哭聲)이 있서 소동이 일어난 까닭은 중궁께서 입시(入侍)하셨는데 상께서 말씀하시되 혹 사생(死生)을 영결(永訣)하는 상황 같은 데다 기(氣)가 절로 끊어지는 것을 아주 깨닫지 못하시기 때문에 그런 것이었고, 기가 끊어지려 하다가 이제는 되살아나셨습니다. 상께서 지번 에게 ‘내가 잡언(雜言)을 잘못 듣고 망령되게 스스로 동심(動心)하였을 뿐이다.’ 하셨는데, 박세거 가 들어가 아뢰기를 ‘상께서 어찌하여 스스로 너그럽게 하지 않고 너무 잗달게 슬퍼하고 상심하십니까? 애쓰실 것은 음식을 들고 빨리 조리하시는 데에 있을 뿐입니다.’ 하니, 상께서 윤임 을 돌아보며 ‘그가 무슨 일을 말하였는가?’ 하자, 윤임 이 사실대로 대답하였으나, 상께서는 오히려 기운이 쳐져 답하지 못하셨습니다.""","○申時, 上證極爲危急。 中宮無可奈何, 欲斷指以進之。 言洩于外, 領相<index num=""0854862_0"" ref=""M_0003908"" sort=""K"" type=""이름"">尹仁鏡</index>等亦泣數行下, 仍以斷指事無益於此證, 請止之。 俄而<index num=""0854863_0"" ref=""M_0003726"" sort=""K"" type=""이름"">柳之蕃</index>出<annotation type=""원주"">                 <noteContent>【藥房提調及承旨、史官等, 時猶在于<index num=""0854864_0"" sort=""K"" type=""지명"">忠順堂</index>前。】</noteContent>               </annotation>曰: ""今刻入診上脈, 則尤爲細數, 或多間斷, 極爲可悶也。"" 前刻宮中, 有哭聲而騷動者, 以中宮入侍, 上與之語, 或如死生永訣之狀, 而殊不覺氣之自絶而然, 氣將絶而今則蘇矣。 上謂<index num=""0854865_0"" ref=""M_0003726"" sort=""K"" type=""이름"">之蕃</index>曰: ""予誤聽雜言, 妄自動心耳。"" <index num=""0854866_0"" ref=""M_0002510"" sort=""K"" type=""이름"">朴世擧</index>入曰: ""自上何爲不自寬, 而太屑屑悲傷乎? 所可勉者, 只在進食飮速調治耳。"" 上顧<index num=""0854867_0"" ref=""M_0000383"" sort=""K"" type=""이름"">尹任</index>曰: ""彼言何事?"" <index num=""0854868_0"" ref=""M_0000383"" sort=""K"" type=""이름"">任</index>對以實, 上猶沈困不答。 "
kla_10106029_008,대사하여 중외에 반포한 교서,1545-06-29L0,"대사하여 중외(中外)의 대소 신료(大小臣僚)·한량(閑良)·기로(耆老)·군민(軍民) 등에게 교서(敎書)를 내렸다. ""왕은 이른다. 하늘이 이미 재앙을 내려 선왕께서 승하하신 지 1주년이 못되었는데, 신(神)이 또한 돕지 아니하여 내 몸에 병이 나서 이미 수순(數旬)이 지났다. 하늘에 무슨 죄를 지었는지 스스로 매우 꾸짖을 뿐이다. 그러나 병이 오래 위중함이 이토록 극도에 이르니 종사(宗社)는 장차 어디에 의지하겠는가. 인(仁)을 베풀려면 먼저 용서하는 마음을 미루어 행하는 것이 급한 일인데, 생각하면 형옥(刑獄)의 결단에 억울한 일이 많이 있을 것이니, 은택을 베풀어서 씻어 주어 내 죄를 빌어야 하겠다. 이번 6월 29일 어둑새벽 이전의 모반 대역(謀反大逆)·모반(謀叛)·자손모살구매조부모부모(子孫謀殺毆罵祖父母父母)·처첩모살부(妻妾謀殺夫)·노비모살주(奴婢謀殺主)·고독(蠱毒)·염매(魘魅)·모고살인(謀故殺人)·관계광상(關係綱常)과 일이 장도(贓盜)에 관계된 것을 제외한 사죄(死罪) 이하의 도(徒)·유(流)·부처(付處)·안치(安置)·충군(充軍)·영속(永續)·정속(定屬)된 잡범(雜犯)은, 이미 배소(配所)에 이르렀건 배소에 이르지 않았건 이미 발각되었건 발각되지 않았건 이미 결정(決定)하였건 결정하지 않았건 모두 용서한다. 그러므로 교시(敎示)하니 잘 알아야 할 것이다.""","○大赦。 敎中外大小臣僚、閑良、耆老、軍民等:                            <quotation>王若曰, 天旣降災, 先王上賓, 未周一歲, 神亦不佑, 寡躬遘疾, 已踰數旬。 未省何辜于天, 徒自切責于己。 然彌留至於斯極, 乃宗社將何所依? 行仁之先, 推恕爲急。 慮於刑獄之(卜)<annotation type=""교감주"">                   <noteTitle>〔下〕</noteTitle>                 </annotation>, 而有冤枉之多。 宜加恩而蕩掃, 以謝予之罪咎。 自今六月二十九日昧爽以前, 除謀(叛)<annotation type=""교감주"">                   <noteTitle>〔反〕</noteTitle>                 </annotation>大逆、謀叛、子孫謀殺毆罵祖父母ㆍ父母、妻妾謀殺夫、奴婢謀殺主、蠱毒魘魅、謀故殺人、關係綱常、事干贓盜外, 雜犯死罪以下徒、流、付處、安置、充軍、永屬、定屬, 已至配所未至配所, 已發覺未發覺, 已決正未決正, 咸宥除之。 故玆敎示, 想宜知悉。</quotation>              "
