article_id,title,lunar_date,text_kor,text_han
kla_10101003_003,헌부가 송겸·임세무의 추고를 청하다,1545-01-03L0,"헌부가 아뢰기를, ""모든 공사(公事) 014) 의 출입은 반드시 정원을 거치게 해야만이 정령(政令)을 내고 시행하는 것이 광명 정대하게 되어 거짓이 발붙일 데가 없게 되는 것입니다. 한 가지 일이라도 정원을 거치지 않고 들어가는 것이 있게 되면 간사한 길이 점차 열리게 되고 따라서 뒷날의 화(禍)가 끝이 없게 되는 것입니다. 송겸(宋㻩) · 임세무(林世茂) 는 망극한 때를 당하여 사사로운 부탁을 받아들여 산릉(山陵)의 각 색장(各色掌) 015) 을 지나치게 많이 뽑아 적어서 틈을 타 입계하였으니, 관계되는 바가 가볍지 않음은 물론 이를 들은 사람들은 경악하고 있습니다. 정시(正始)의 처음에는 모든 일을 한결같이 바른 데에서 나오게 해야 하는 것이니, 이처럼 부정한 일이 있으면 위에서 두렵게 여기고 돌이켜 생각하여 그 조짐을 막으셔야 합니다. 그런데 앞뒤로 대간이 날마다 잇달아 논계하여도 아직 윤허를 받지 못하였으니 신들은 서운함을 견딜 수 없습니다. 송겸 · 임세무 를 빨리 추고(推考)하여 죄를 다스리소서. 승지(承旨)는 후설(喉舌)의 지위에 있으므로 왕명의 출입을 미덥게 해야만 할 것인데, 근래 승지들이 공사를 출입함에 있어 조금도 유의하지 않아서 전도되는 일이 많고 위의 뜻을 받들어 따르기만을 힘쓸 뿐 바로잡는 일은 하지 않습니다. 처음에는 정원을 거치지 않고 들어갔더라도 정원에 내려졌으면 곧 들어간 연유를 상세히 살펴서 간사한 짓을 바로잡았어야 했는데, 태연히 살피지 않고 판하(判下)에만 급급 하였으니, 잘못한 것이 매우 중합니다. 색승지(色承旨) 016) 는 파면하고 도승지(都承旨)는 체직시키소서."" 하고, 또 정웅(鄭熊) 의 일을 아뢰니, 답하기를, "" 송겸 등의 일은 부정한 데에 관계되는 듯하니 아뢴 바를 따라야 마땅하겠으나, 창졸간이라서 전례를 살피지 못하였을 뿐이지 어찌 다른 뜻이 있었겠는가. 송겸 은 전에 중임(重任)을 받은 것을 어쩔 수 없이 교체한 것도 온편하지 못한데 또 이 일 때문에 추고하여 다스린다면 어찌 심한 일이 아니겠는가. 임세무 도 중임을 맡고 있는데 이제 추고하여 다스리면 위를 위하는 의리에 어긋날 듯하니 추고하여 다스릴 것은 없다. 색승지와 도승지에 대한 일은 이미 죄다 일렀으니 파체(罷遞)할 것 없다. 정웅 은 문관(文官)이니 경력에서 체직시키면 반드시 부끄러움을 알아 허물을 뉘우칠 것이다. 파면할 것 없다."" 하였다.","○憲府啓曰: ""凡公事出入, 必由政院然後, 發政施令, 光明正大, 矯僞無所托矣。 如有一事不由政院而入, 則邪逕漸開, 後禍無窮。 <index num=""0852169_0"" ref=""M_0048362"" sort=""K"" type=""이름"">宋㻩</index>、<index num=""0852170_0"" ref=""M_0045149"" sort=""K"" type=""이름"">林世茂</index>, 當罔極之際, 聽從私囑, 山陵各色掌, 濫數抄錄, 乘間入啓, 所關非輕, 人聽驚愕。 正始之初, 當令事事一出於正, 若有如此不正之事, 則自上當驚惕省念, 以杜其漸。 前後臺諫, 連日論啓, 尙未蒙允, 臣等不勝缺望。 <index num=""0852171_0"" ref=""M_0048362"" sort=""K"" type=""이름"">宋㻩</index>、<index num=""0852172_0"" ref=""M_0045149"" sort=""K"" type=""이름"">林世茂</index>, 請亟推考治罪。 承旨居喉舌之地, 出入所當惟允, 近來承旨等, 出入公事之際, 略不經意, 事多顚倒, 唯務奉順, 不事矯正。 初雖不由政院而入, 旣下政院, 則卽當詳察所入之由, 以矯奸枉, 而慢不致察, 汲汲判下, 所失甚重。 色承旨, 請罷, 都承旨, 請遞。"" 又啓<index num=""0852173_0"" ref=""M_0054394"" sort=""K"" type=""이름"">鄭熊</index>事, 答曰: ""<index num=""0852174_0"" ref=""M_0048362"" sort=""K"" type=""이름"">宋㻩</index>等事, 似涉不正, 當從所啓, 然倉卒之間, 不能察其前例而已, 豈有他意? <index num=""0852175_0"" ref=""M_0048362"" sort=""K"" type=""이름"">宋㻩</index>, 前受重任, 不得已遞之, 猶爲未便, 又以此事推治, 豈不甚哉? <index num=""0852176_0"" ref=""M_0045149"" sort=""K"" type=""이름"">林世茂</index>, 亦當重任, 今若推治, 恐乖於爲上之義, 不須推治。 色承旨、都承旨事, 已悉言之, 不須罷遞。 <index num=""0852177_0"" ref=""M_0054394"" sort=""K"" type=""이름"">鄭熊</index>, 文官也, 遞經歷, 必知恥而悔過, 不須罷之。"" "
kla_10101004_004,헌부에서 창덕궁으로 옮길 것을 청하다,1545-01-04L0,"헌부가 또 아뢰기를, ""이제 자전(慈殿)께서 그대로 창경궁(昌慶宮) 에 계시므로 전하께서도 거기에서 가까이 모시려 하시니 효성이 지극하십니다. 다만 창경궁 은 본디 법궁(法宮) 019) 이 아니기 때문에 선왕(先王)께서도 오래 머물러 계신 적이 없으므로 궐내(闕內)에서 시위(侍衛)하는 장졸(將卒)들이 입직할 곳이 없어서 춥거나 더울 때를 막론하고 한데에 서 있게 되어 그 괴로움을 견디지 못할 정도이니, 이곳은 임금이 늘 계실 곳이 못됩니다. 또 성종(成宗) 때에는 늘 창덕궁(昌德宮) 에 계시면서 창경궁 으로 왕래하며 대비전(大妃殿)에 문안하셨는데, 두 궁은 담 하나를 사이에 두고 있을 뿐이어서 곁에서 모시는 것과 다를 것이 없었습니다. 졸곡(卒哭) 020) 이 지난 뒤에는 창덕궁 으로 옮기고 문정전(文政殿) 을 혼전(魂殿) 021) 으로 삼으소서. 형조는 사송(詞訟)이 번다하므로 하루도 장관이 없어서는 안 되는데, 판서 남효의(南孝義) 는 늙고 병들었을 뿐더러 재기(材器)도 모자라서 육조(六曹)의 장관에 맞지 않으니, 체직시키소서."" 하니, 답하기를, ""처음에는 자전께서 창경궁 에 나아가 계셨으므로 내가 가까이 모시려고 선정전(宣政殿) 022) 을 혼전으로 삼으려 하였으나, 이제 아랫사람이 직숙(直宿)할 곳이 없을 뿐더러 폐단도 많이 있다 하니 아뢴 대로 하라. 송겸 등의 일에 대해서는 내 뜻을 이미 다 일렀다. 남효의 는 전에 한성부의 장관을 지냈었고 형조에는 또한 참판(參判)과 참의(參議)가 있으니, 병이 있더라도 조리하면 사진(仕進)할 수 있을 것이다. 체직할 것은 없다."" 하였다.","○憲府又啓曰: ""今以慈殿仍御<index num=""0852180_0"" sort=""K"" type=""지명"">昌慶宮</index>, 殿下亦欲侍側於此, 孝則至矣。 但<index num=""0852181_0"" sort=""K"" type=""지명"">昌慶宮</index>本非法宮, 先王無久御之時, 故闕內侍衛將卒, 無入直之處, 寒暑露處, 不堪其苦, 此非人君常御之所。 且在<index num=""0852182_0"" ref=""M_0000328"" sort=""K"" type=""이름"">成廟</index>朝, 常御<index num=""0852183_0"" sort=""K"" type=""지명"">昌德宮</index>, 往來<index num=""0852184_0"" sort=""K"" type=""지명"">昌慶宮</index>, 問安于大妃殿, 兩宮之間, 只隔一墻, 無異侍側。 卒哭後, 請移御<index num=""0852185_0"" sort=""K"" type=""지명"">昌德宮</index>, 以<index num=""0852186_0"" sort=""K"" type=""지명"">文政殿</index>爲魂殿。 刑曹詞訟浩繁, 不可一日無長官, 判書<index num=""0852187_0"" ref=""M_0002208"" sort=""K"" type=""이름"">南孝義</index>, 非徒老病, 材器淺短, 不合六曹長官, 請遞。"" 答曰: ""初以慈殿御<index num=""0852188_0"" sort=""K"" type=""지명"">昌慶宮</index>故, 予欲侍側, 而以<index num=""0852189_0"" sort=""K"" type=""지명"">宣政殿</index>爲魂殿。 今非特下人無直宿之處, 亦多有弊, 可如啓。 <index num=""0852190_0"" ref=""M_0048362"" sort=""K"" type=""이름"">宋㻩</index>等事, 予意已盡言之矣。 <index num=""0852191_0"" ref=""M_0002208"" sort=""K"" type=""이름"">南孝義</index>, 前爲<index num=""0852192_0"" sort=""K"" type=""지명"">漢城府</index>長官, 刑曹亦有參判、參議, 雖有病, 若調理, 則可以仕矣。 不須遞之。"" "
kla_10101007_002,"대사간 임억령, 집의 한두 등이 대간의 임무에 대해 아뢰다",1545-01-07L0,"대사간 임억령(林億齡) , 집의 한두(韓㞳) , 사간 한주(韓澍) , 장령 권물(權勿) , 지평 이천계(李天啓) · 이담(李湛) , 헌납 성세장(成世章) , 정언 조광옥(趙光玉) · 김난상(金鸞祥) 이 명을 받고 와서 아뢰기를, ""무릇 국가의 일에 대해 조정이 의논하여 정한 데에 잘못된 것이 있으면 대간이 바로잡는 것입니다. 이번 흑립과 백립에 관한 의논에 대간도 함께 참여하라고 전교하셨는데, 대간이 참여한다면 잘못된 것이 있을 경우 누가 바로잡을 수 있겠습니까? 함께 참여하지 말게 하소서."" 하니, 답하기를, ""성묘 때에 대간과 홍문관이 이 일을 같이 의논하였기 때문에 말한 것이다. 어제 참판 등의 의논이 《오례의(五禮儀)》 와 서로 맞고 나도 백립으로 하기를 바라고 있으나 물론이 일치되지 않는다. 그래서 널리 의논하도록 명한 것인데, 이는 바로잡기를 기다리지 않고 바른 데로 돌아가게 하려는 것이다. 의논하여 아뢰도록 하라."" 하였다. 임억령 등이 다시 아뢰기를, ""대간의 직무는 시비를 바로잡는 것일 뿐이므로 조정의 의득(議得)에 참여할 수 없습니다. 전에 혹 의논에 참여한 때가 있다 해도 그 전례가 이미 잘못된 것이니 이 일을 원용하여 상례(常例)로 삼을 수는 없습니다. 반복하여 생각하여 보아도 직분을 넘어서 논의하는 것은 사체에 크게 해로운 것이기에 감히 아룁니다."" 하니, 답하기를, ""홍문관이 의주(儀註) 039) 를 따를 것을 의논해 아뢰었고 【아래에 보인다.】 내 생각에도 반드시 백립을 써야 할 듯하니 대간은 의논할 것 없다."" 하였다.  사신은 논한다. 위에서 예(禮)를 좋아하는 것이 매우 독실해서 공경(公卿)의 구차하고 간략한 의논을 따르지 않고 신충(宸衷)으로 결단하여 3년 동안 백립을 쓸것으로 제도를 정하였으니, 후세에 모범이 될 만하다.","○大司諫<index num=""0852312_0"" ref=""M_0005595"" sort=""K"" type=""이름"">林億齡</index>、執義<index num=""0852313_0"" ref=""M_0060097"" sort=""K"" type=""이름"">韓㞳</index>、司諫<index num=""0852314_0"" ref=""M_0059885"" sort=""K"" type=""이름"">韓澍</index>、掌令<index num=""0852315_0"" ref=""M_0000123"" sort=""K"" type=""이름"">權勿</index>、持平<index num=""0852316_0"" ref=""M_0005271"" sort=""K"" type=""이름"">李天啓</index>ㆍ<index num=""0852317_0"" ref=""M_0000487"" sort=""K"" type=""이름"">李湛</index>、獻納<index num=""0852318_0"" ref=""M_0002890"" sort=""K"" type=""이름"">成世章</index>、正言<index num=""0852319_0"" ref=""M_0014842"" sort=""K"" type=""이름"">趙光玉</index>ㆍ<index num=""0852320_0"" ref=""M_0001437"" sort=""K"" type=""이름"">金鸞祥</index>承命來啓曰: ""凡國家之事, 朝廷議定, 如有失誤, 臺諫糾正。 今此黑、白笠之議, 臺諫同參事傳敎, 臺諫若參, 則雖有失誤, 誰得以糾正乎? 請勿同參。"" 答曰: ""<index num=""0852321_0"" ref=""M_0000328"" sort=""K"" type=""이름"">成廟</index>朝, 臺諫、弘文館同議此, 故言之矣。 昨日參判等議, 與<index num=""0852322_0"" type=""서명"">《五禮儀》</index>相合, 予亦欲白笠, 而物論不一。 故命爲廣議者, 不待糾正而欲歸於正矣。 議啓可也。"" <index num=""0852323_0"" ref=""M_0005595"" sort=""K"" type=""이름"">億齡</index>等再啓曰: ""臺諫之職, 糾正是非而已, 不可與於朝廷議得。 前者雖或有參議之時, 其例已誤, 不可援此以爲常也。 反覆思之, 越職論議, 大妨事體, 故敢啓。"" 答曰: ""弘文館議從<index num=""0852324_0"" type=""서명"">《儀註》</index>,<annotation type=""원주"">                 <noteContent>【見下】</noteContent>               </annotation>予意亦以爲定用白笠, 臺諫不必議也。""                            <postScript type=""史論"">                 【史臣曰: ""上之好禮甚篤, 故不從公卿苟簡之議, 而斷自宸衷, 定爲三年白笠之制, 足以垂範於後矣。""】               </postScript>                        【史臣曰: ""上之好禮甚篤, 故不從公卿苟簡之議, 而斷自宸衷, 定爲三年白笠之制, 足以垂範於後矣。""】 "
kla_10101007_003,홍문관 부제학 송세형 등이 졸곡 후의 복제에 대해 아뢰다,1545-01-07L0,"홍문관 부제학 송세형(宋世珩) 등이 의논하여 아뢰기를, ""졸곡 뒤에 위에서는 익선관에 오서대를 하고 신하들은 오관(烏冠)에 오대(烏帶)를 쓰는 것은 조회에서 일을 처리하기 위하여 어쩔 수 없이 권제(權制)를 쓴 것으로 순전히 길복(吉服)을 쓸 수 없었기 때문입니다. 상례(喪禮)에 관한 모든 일에 있어 최복(衰服) 040) 을 입는다면 최마(衰麻)가 오히려 몸에 있는 것인데, 유독 사사로이 있을 때에는 상제(喪制)를 죄다 버리고 갓을 검게 한다는 것은 이치에 맞지 않을 듯합니다. 조종 때에는 다 백립을 썼는데 성종 때에 한때의 의논에 따라 비로소 옛 제도를 바꾸었으나 오히려 ‘흉을 바꾸어 길을 따르는 것은 마음에 미안하다.’는 분부가 계셨으니, 성묘 의 뜻도 알 수 있습니다.  주자(朱子) 가 ‘임금이 상중(喪中)에 있으면서 백포(白布)로 된 의관(衣冠)으로 조정에 임하여도 안 될 것은 없다.’고 하였습니다. 조정에 임하여 신하들을 볼 때에도 백포의 의관을 쓸 수 있는데, 더구나 한가히 있을 때에 오로지 길복을 쓰는 것이겠습니까. 임금도 그러한데 더구나 신하들이겠습니까. 누구나 삼년상을 입는 것은 하늘의 도리이고 땅의 의리이므로 사사로운 뜻으로 증감하는 것은 있을 수 없습니다. 《오례의》 는 우리 나라의 열성(列聖)들께서 고금의 예절을 참작하여 만세에 항상 행할 제도를 제정한 것이니, 후사(後嗣)로서는 당연히 준수해야 하는 것이요 고쳐서는 안 되는 것입니다. 이제 구차히 근래의 전례를 따라 반드시 다시 그르치려 하니 매우 온편하지 못합니다. 지금 우리 나라의 풍속은 늘 흰옷을 입는 것이 조종 때보다 더한데, 갓까지 검게 한다면 여느 때와 조금도 다를 것이 없으니 신들은 슬픔도 따라서 없어지고 예의도 따라서 무너질까 염려됩니다. 신들의 생각으로는 군부를 위한 큰 복제(服制)는 결코 흉을 바꾸어 길을 따르고 후한 것을 버리고 박한 것을 따를 수 없다고 여겨지니, 한결같이 《오례의》 에 따라서 거행하소서."" 하니, 답하기를, ""내 뜻도 그러하니 《오례의》 를 따르도록 하라."" 하였다.","○弘文館副提學<index num=""0852325_0"" ref=""M_0003004"" sort=""K"" type=""이름"">宋世珩</index>等議啓曰: ""卒哭後, 上御翼善冠、烏犀帶, 群臣皆用烏冠、烏帶, 此雖爲公朝治事, 不得不用權制, 亦不敢純用吉服。 至於凡干喪事着衰服, 則衰麻猶在其身矣, 獨於私居, 盡去喪制, 欲黑其笠, 恐爲無理。 祖宗朝皆用白笠, 而猶在<index num=""0852326_0"" ref=""M_0000328"" sort=""K"" type=""이름"">成宗</index>朝, 因一時之議, 始變舊制, 而猶有變凶從吉心所未安之敎, <index num=""0852327_0"" ref=""M_0000328"" sort=""K"" type=""이름"">成廟</index>之意, 亦可見矣。 <index num=""0852328_0"" ref=""M_0033766"" sort=""A"" sort2=""宋"" type=""이름"">朱子</index>以爲: ‘人君在喪, 而白布衣冠以臨朝, 未爲不可。’ 臨朝見群臣, 猶可以白布衣冠, 況於燕處, 專用吉服? 人主尙然, 況於群下乎? 三年通喪, 天經地義, 不容私意有所短長。 而<index num=""0852329_0"" type=""서명"">《五禮儀》</index>, 乃我朝列聖參酌古今之禮, 立萬世常行之制, 在後嗣所當遵守, 而不可撓改。 今者苟循近例, 必欲再誤, 至爲未便。 當今國俗, 常着白衣, 甚於祖宗朝, 若幷黑其笠, 則與平日, 頓無差別, 臣等恐哀隨而亡, 禮從而壞也。 臣等之意, 爲君父大服, 決不可變凶從吉, 舍厚趨薄, 請一依<index num=""0852330_0"" type=""서명"">《五禮儀》</index>施行。"" 答曰: ""予意亦然, 可從<index num=""0852331_0"" type=""서명"">《五禮儀》</index>。"" "
kla_10101007_004,우의정 윤인경 등이 시호를 중조로 하는 것이 부당하다고 아뢰다,1545-01-07L0,"우의정 윤인경(尹仁鏡) 등이 【의시(議諡)한 재상이 다 모였다.】 아뢰기를, ""폐조 때에 종사(宗社)가 간발의 위태로움에 있었는데 온 나라의 신민(臣民)이 대행 대왕을 추대하여 성묘 의 계통을 잇게 되었으니, 중흥의 덕이 막대하였습니다. 그러니 조정이 범연하게 의논하여 중종(中宗) 이라는 호를 올린 것이 아닙니다. 대저 의시는 큰 일이므로 조정이 이미 의논하여 정하였으면 고칠 수 없는 것입니다. 또 어제 세조 께서 노산 을 잇고 대행 대왕께서 폐왕을 이으셨다는 뜻으로 전교하셨습니다만, 노산 과 폐왕은 모두 도리를 잃은 임금이므로 강봉(降封)하여 군(君)이라 칭하였으니 대를 이을 수가 없습니다. 대행 대왕께서는 성종 을 승습(承襲)하여 즉위하셨으니 조(祖)로 칭하는 것은 부당합니다. 그러므로 감히 아룁니다."" 하니, 답하기를, ""내 생각에는 부왕께서 중흥한 공이 있으므로 조호(祖號)로 칭하고자 하였다. 그러나 다시 생각하니 성묘 의 계통을 이어받으신 것이다. 다시 의논할 것 없다."" 하였다.","○右議政<index num=""0852332_0"" ref=""M_0003908"" sort=""K"" type=""이름"">尹仁鏡</index>等<annotation type=""원주"">                 <noteContent>【議諡宰相皆會。】</noteContent>               </annotation>啓曰: ""廢朝宗社危如一髮, 而一國臣民推戴大行大王, 承<index num=""0852333_0"" ref=""M_0000328"" sort=""K"" type=""이름"">成廟</index>之統, 其中興之德莫大焉。 故朝廷不偶然議而上號<index num=""0852334_0"" ref=""M_0057021"" sort=""K"" type=""이름"">中宗</index>。 大抵議諡大事, 朝廷旣議定, 則不可改也。 且昨日, 以<index num=""0852335_0"" ref=""M_0047665"" sort=""K"" type=""이름"">世祖</index>繼<index num=""0852336_0"" ref=""M_0036364"" sort=""K"" type=""이름"">魯山</index>, 大行大王繼廢王之意傳敎, 而<index num=""0852337_0"" ref=""M_0036364"" sort=""K"" type=""이름"">魯山</index>、廢王皆失道之君, 故降封稱君, 而不得繼世。 大行大王則承襲<index num=""0852338_0"" ref=""M_0000328"" sort=""K"" type=""이름"">成宗</index>而立, 不當稱祖, 故敢啓。"" 答曰: ""予意以爲父王, 有中興之功, 故欲稱祖號, 而更計則承<index num=""0852339_0"" ref=""M_0000328"" sort=""K"" type=""이름"">成廟</index>之統。 不須更議也。"" "
kla_10101008_002,"장령 권물, 지평 이천계·이담이 체직시켜 줄 것을 청하다",1545-01-08L0,"장령 권물 , 지평 이천계 · 이담  【장령                           곽순(郭珣)은 병을 앓고 대사헌                           이해(李瀣)는 아직 숙배(肅拜) 042) 하지 않았다.】 이 아뢰기를, ""좌의정 홍언필 은 정승 자리에 합당하지 않아서 공론이 드러나게 발론되었습니다. 그리하여 대간이 논계하였는데 아직 윤허받지 못한 채 홍언필 이 스스로 해결한 것으로 핑계하고는 곧 정계(停啓)하였으므로 물론이 더욱 울분해 하고 있습니다. 신들은 본직(本職)에 제수된 즉시 곧 다시 아뢰었어야 했는데도 다시 아뢰지 않았을 뿐더러 서로 용납하여 물론이 비난하고 있으니 사세가 직에 있을 수 없습니다. 신들을 체직시켜 주소서."" 하니, 답하기를, ""대신의 일에 대해 그때의 대간이 어찌 범연하게 생각하여 정계하였겠는가. 이미 정계하였으니 이제 굳이 논집할 것은 없다. 또 서로 용납한들 무엇이 해롭겠는가. 사퇴하지 말라."" 하였다. 권물 등이 다시 아뢰었으나 윤허하지 않자 물러가면서 아뢰기를, ""물론을 기다리겠습니다."" 하였다.","○掌令<index num=""0852341_0"" ref=""M_0000123"" sort=""K"" type=""이름"">權勿</index>、持平<index num=""0852342_0"" ref=""M_0005271"" sort=""K"" type=""이름"">李天啓</index>ㆍ<index num=""0852343_0"" ref=""M_0000487"" sort=""K"" type=""이름"">李湛</index>               <annotation type=""원주"">                 <noteContent>【掌令<index num=""0852344_0"" ref=""M_0000076"" sort=""K"" type=""이름"">郭珣</index>病, 大司憲<index num=""0852345_0"" ref=""M_0000773"" sort=""K"" type=""이름"">李瀣</index>未肅拜。】</noteContent>               </annotation>啓曰: ""左議政<index num=""0852346_0"" ref=""M_0006619"" sort=""K"" type=""이름"">洪彦弼</index>, 不合相位, 公論顯發。 臺諫論啓, 未蒙允(愈)<annotation type=""교감주"">                 <noteTitle>〔兪〕</noteTitle>               </annotation>, 諉諸<index num=""0852347_0"" ref=""M_0006619"" sort=""K"" type=""이름"">彦弼</index>自處, 旋卽停啓, 物論愈鬱。 臣等除授本職, 當卽更啓, 而非徒不爲更啓, 又與之相容, 物論非之, 勢不可在職。 請遞臣等之職。"" 答曰: ""大臣之事, 其時臺諫豈偶然計而停啓乎? 旣已停啓, 今不必强爲論執。 且與之相容, 有何妨乎? 勿辭。"" <index num=""0852348_0"" ref=""M_0000123"" sort=""K"" type=""이름"">勿</index>等再啓, 不允。 退曰: ""當待物論。"" "
kla_10101101_004,좌의정 윤인경 등이 옥체 보전을 위해 조석전만은 지낼 것을 청하다,1545-01-01L1,"좌의정 윤인경 등이 아뢰기를, ""신들이, 상의 옥체가 수척하시다는 말을 듣고 면대(面對)를 청하려 한 지 오래 되었습니다마는, 접견하는 절차가 어려울 듯하기에 아뢰지 못하였습니다. 신들의 생각으로는 상의 옥체에 혹 내상(內傷)이 있는데도 애통하기 그지없는 중이라서 스스로 깨닫지 못하시는 듯하니, 의원에게 명하여 들어와 맥도(脈度)를 진찰하게 하소서. 또 하현궁하는 날에는 밤을 무릅쓰고 친히 거행하실 것이므로 그 전에 조리하고 보전하는 방도를 극진히 하셔야 할 것인데 하루에 다섯 번 곡림(哭臨)하신다 하니, 신들은 민망하고 염려스러움을 금치 못하겠습니다. 조석전(朝夕奠) 외에 세 때의 상식(上食)은 친히 지내지 마소서."" 하니, 답하기를, ""나에게 증세가 별로 없는데 진찰해야 할 필요가 뭐 있겠는가? 산릉(山陵)에 모실 날짜가 다가오는데 곡림을 어찌 차마 줄일 수 있겠는가."" 하였다.","○左議政<index num=""0852750_0"" ref=""M_0003908"" sort=""K"" type=""이름"">尹仁鏡</index>等啓曰: ""臣等伏聞上體羸瘁, 欲請面對久矣。 恐接見節次或難, 故不得啓達。 臣等竊恐上體或有內傷, 而哀痛罔極之中, 不自覺也, 乞命醫員, 入診脈度。 且下玄宮日, 冒夜親行, 其前調保, 須極其方, 而一日之內, 五度哭臨云, 臣等不勝憫慮。 朝、夕奠外, 三時上食, 請勿親行。"" 答曰: ""予別無病證, 何必診候? 山陵日迫, 哭臨, 豈忍減乎?"" "
